"","course_ids","created","id","professor_ids","review_text","workload_text","department_ids","name","number"
"1","1921","Mon, 19 May 2003 00:00:00 GMT","5769","1636","Allegedly Columbia's resident machine learning guru, Jebara is an extremely mediocre professor.  The lecture slides were unhelpful at best, and he basically just reads off of them during lecture with some supplementary doodling on the blackboard.  Still, he's a nice guy who will be happy to explain stuff in office hours, but I found the books to be the most helpful, especially for the homeworks.  As for the course, be ready for A LOT of stat and linear algebra before you get to the good stuff.","Four cookbook homework assignments using MATLAB (start early), a moderately difficult midterm, a virtually impossible final, and an open-ended project/paper.  ","7","Machine Learning","COMS W4771"
"2","1921","Mon, 26 Jun 2006 00:00:00 GMT","15167","1636","One of the worst professors at Columbia.  Not a mean guy, by any means, probably a genius in his field, yet not a very effective lecturer.  Be sure to know your linear algebra and calculus cold because this is what this course is all about.  If you're a statistics major, all the better, the course will be a breeze for you.  All the rest, keep out.","Not too bad, if you understand the material.","7","Machine Learning","COMS W4771"
"3","1921","Fri, 16 Feb 2007 00:00:00 GMT","18687","1636","My opinion is opposite to that of the other two reviews. While I do not rate him as the best guy in the department, he is not as bad as the other two reviews suggest. Machine Learning is a specialized field, unlike other core cs courses, it is interdisciplinary. It does need a good background in Linear Algebra, Calculus and a bit of statistics. WIth the right background, if the course is taken, the course is really enjoyable. Some of his slides are really good (again if you have the right background needed). Compared to Machine Learning home works given at other schools by other professors, his home works really make you understand what you implement. Overall I would give an A- for his course. I would like to stress that you need right background and interest to appreciate his classes","","7","Machine Learning","COMS W4771"
"4","1921","Wed, 02 Apr 2008 00:00:00 GMT","21074","1636","Nice guy, a horrible professor. The main problem is that he tries to fit way too much information into slides and is so boring that you stop caring about the course. He also interlaces examples while introducing examples, which may seem like a good idea, but Prof. Jebara introduces them at such bad times that you don't learn anything. 
Also, the homework is embarrassingly easy and you don't learn anything, so by the time exams roll around, you don't have a clue what happened in the class.

Before people spout off bullshit about how machine learning is hard, try to find a lecture about ML by Andrew Ng (Stanford), Michael Jordan (Berkeley), or Tommi Jaakkola (MIT), or for a different flavor Carlos Guestrin (CMU). All the classes they teach cover more material, but the students are able to understand more material and understand it better.","Two bad exams, 6 joke homeworks","7","Machine Learning","COMS W4771"
"5","1921","Sun, 16 May 2010 00:02:00 GMT","24411","1636","There's a lot of debate on the background required to take/enjoy this course. Let me give you mine: Linear algebra (important, forgot), Gradients/Hessian (slightly important, forgot), diff/integ of exp, log, poly (important, very good), Probability (most important, Very good), Statistics (not needed, forgot), Optimization (slightly important, none), MATLAB (most important, none). Do not let people intimidate you, you can still do very well in this course by honest effort. Besides Prof. Jebara is a very good and considerate teacher who buffers his lectures with essential background material. 

I'm puzzled with the other reviewer's comments regarding the material with respect to Ng et al. The combination of topics such as SVMs, VC Dim, graphical models and Back propagation is rare. Digging deeper, 6.867 at MIT is very similar in scope.

His slides are a work of art! Beautifully thought out with rich visual cues.

TAs were brilliant (Pier Francesco Palamara and David Bondatti). Patient, welcoming and knew the material inside out.","Very well designed assignments. These involve translating/extending the equations in class to new distributions and settings and implementing them in MATLAB for a non-trivial data set. I feel very happy doing them because I know I will know EM, Junction Tree etc. inside out rather than wrestling some artificially hard time drain. Exams are challenging but fun! Make sure to get plenty of sleep and work out the practice exams WITHOUT referring to your notes.","7","Machine Learning","COMS W4771"
"6","1921","Wed, 27 Apr 2011 19:04:08 GMT","25772","1636","One of my least favorite classes at Columbia.  I am sure the professor is a genius in his field, but it was not well executed or translated to undergrads.  The lectures were dry at best - the class was not engaged.  The lectures were very repetitive - you realy only needed to go to every other class as he spend the first half reviewing and the second half teaching (though I did go to every class).  The slides were confusing with too much information crammed into them.

The teacher was not very approachable - I went to his office hours but he was unable to explain the proof in question to me.

Much of the course was over my head, in part because the prerequisites did not prepare me.  Iw as not alone in this, but the course was not taught with this in mind.

The TA's were horrendous at best.  The did NOT understand teh material.  I would usually start the homework the day it was assigned - if I went to office hours then I was told I was working too early and they were not yet expected to understand the homework.  I was also very annoyed when, after a homework had been live for a week (and I had completed it) it was changed.","Exams were impossible - no idea where he got the concepts from
6 decently straightforward homeworks","7","Machine Learning","COMS W4771"
"7","1921","Thu, 12 May 2011 03:43:43 GMT","25956","1636","This is a very difficult course made much worse by the fact that he simply can't teach.  From what I understand he is very good in his field, but that does not translate into the classroom.

The lectures are confusing and the slides are difficult to understand.  He spends slide after slide on the easiest parts and then glosses over the more difficult concepts because they're ""obvious"".  I and a lot of other students in the class didn't bother to use our notes and materials from his lectures to prepare, instead using the freely available materials for the Stanford machine learning course.  It's absurd how much better they are.

Jebara isn't very approachable.  If you look at his personal web page he has about ten different places where he says he's busy and can't be bothered.  The TA's are hit and miss - there are one or two that are good and will actually try to help, but the rest aren't that great.  I'm pretty sure one of them never actually held office hours.  He just sent out an email that he was canceling every week.

Also, there was a really strange incident that stuck out at me: on one of the homeworks one of the TA's announced they thought there was a lot of cheating going on, as they got a lot of almost identical submissions (something like 40 out of 130ish students), and their response to this was to take a few points off the grade of any student with one of those suspicious homeworks who asked for a regrade.  It just falls in with the fact that, as a general rule, the professor and TA's for this class just can't be bothered.","5 deceptively difficult homework assignments - they seem simple, but you have to look up a lot of math
1 unholy difficult midterm - I thought I was pretty prepared, but there were a lot of hard concepts combined, along with the requirement of doing a lot of big matrix operations we'd been doing in matlab by hand.  Not fun.  For one 20 point question, I got 0 points and a frownie face as the only explanation.
1 final that I'm fairly sure will be a crime against humanity
","7","Machine Learning","COMS W4771"
"8","1921","Sat, 14 May 2011 14:30:43 GMT","25999","1636","Warning: this class should be an applied math course. I attended lecture frequently but learned nearly nothing, and the slides were incomprehensible. He assumed a level of math that was not reflected in the prerequisites whatsoever, but at the same time, he oversimplified some things to the point of being confusing: he explained what an integral was but then, a few lectures later, used Lagrange multipliers without a single word of explanation. The homeworks were nigh impossible, and the midterm was about tangential mathematical properties of the equations that we based algorithms off of. This course is by far the worst grade I've gotten at Columbia, despite the effort I put in.","Five homeworks that take around 6 to 10 hours each.","7","Machine Learning","COMS W4771"
"9","1921","Thu, 19 May 2011 02:16:33 GMT","26119","1636","The topics were extremely interesting. All of the readings were fun and understandable. Unfortunately, the class was enormous with about 200 people and the lectures took a hit.  The instructor had no clue where most of the class was, and questions were rare. The lecture slides and lectures assumed reading ahead of time, and half of the class seemed to be behind. I got an A+ and I didn't do anything special other than read ahead in the book. The class doesn't lost as prerequisites but should MATLAB, optimization (Lagrangians, subgradient and gradient methods, etc.), graduate probability ( measure spaces, Bayes, and conditional/causal reasoning, etc.), lots and lots of linear algebra, and differential equations. It felt like he was trying to fit an entire career of ML into one semester.  

Some I sat next to in class were from basketweaving departments like OR or Business.  This is definitely a math or statistics class. ","Five very challenging homeworks. They would have taken much longer, but the answers were all online from previous years.","7","Machine Learning","COMS W4771"
"10","1921","Wed, 06 Jul 2011 08:20:25 GMT","26290","1636","Most of the reviewers from spring 2011 class have got it right about the lecture style of prof Jebara. He simply can't teach. I think the prerequisites are enough to prepare you for the math covered in the material; you will have the opportunity to explore more of differentials applied to matrices, lagrangian and bayesian probability. 
For me it was pain attending lectures as I could hardly follow him. I guess his lectures were hampered by the size of the class. He would always seem to be in a hurry to cover as much material as he could without really caring whether students understand any of it or not. Like many others, I had to rely on online lectures from Stanford to build a proper understanding of many concepts covered in the class. What a shame! 
Assignments do well in helping you get the feel of the concepts but are not substantial enough to endow confidence to tackle hard problems. Mid-term was a disaster. Final exam was good, I thought.
","Five assignments, a midterm and a final exam. Assignments have programming (in matlab) and non-programming (math) problems. Most of the problems in assignments test basic knowledge, therefore doable in couple of hours. Some (in most cases non-programming problems) are extremely difficult and you would spend days pondering and not get an answer.","7","Machine Learning","COMS W4771"
"11","1921","Sat, 26 Jan 2013 13:01:23 GMT","28050","1636","Top 5 (out of 1,024) reasons to avoid this course at all costs:

1. No matter how much Prob/Stats or Linear Algebra or just MATH in general you *think* you know, you're not ready for this course (especially if you're an undergrad.. if you're a superstar Ph.D student, make your own judgement).  For example, on one of the homeworks, we were asked to perform vector calculus, which is usually not covered in any of the prerequisites. Another example is when we were asked to do multiple indefinite integrals of a particularly long formula, by hand, during a midterm as a problem worth 20% of the grade.

2. He goes through very few examples in class, (and when he does, only a select few understand him) which means that most of the homework problems you have absolutely no idea how to do, even if you took the best notes humanly possible in his incredibly dull lectures. For this reason, academic honesty in its strictest definition (no looking through internet for answers, no collaboration on homeworks) is nowhere to be found, because it is impossible to do 90% of the workload in this class otherwise.

3. He can't teach. I will leave it at this because no other words can describe how truly bad he is.

4. Since this isn't an absolute requirement for any tracks (even for AI, you can take much better courses such as Spoken Language Processing), you can do yourself a favor and take this same course on Coursera or other excellent online alternatives if you would really like to learn Machine Learning. This is more ideal since Jebara's class is the least efficient place to do any learning.

5. http://www1.cs.columbia.edu/~jebara/ Look at his picture. He is smiling smugly at the pains you will have to go through to survive in his course.","5 Homeworks (5-20 hours of RESEARCH, because you ain't solving these with what you ""learned"" in class)
1 Midterm (Average was around 50)
1 Final","7","Machine Learning","COMS W4771"
"12","1921","Sat, 14 Dec 2013 21:27:07 GMT","28865","1636","Machine Learning by Prof. Jebara was an excellent class. There are not many graduate classes at Columbia where you feel you have learnt your money's worth. Trust me, this is one class where you will feel challenged and inspired. Prof. Jebara is good with giving intuitions about many things, picking examples from Vision, Genomics, NLP. You many find this course ""hard"", or ""uninteresting"", if you thought ML is ""cool"", or the sole image of Machine Learning in your head is from ML class by Andrew Ng on Coursera. This is a very maths based course, and he mentions this in the first class, and urges people to drop if they can't handle it. I guess it is fair on his part, to announce that the maths will be slighty tough, I wouldn't say even tough, just different. This course will help you a lot, if you want to read Machine Learning papers, do research in the field, because there is some very odd notation involved and the course will teach you that. My vote is take this course, if you are ready to dive into hour long lectures of Mathematical Proofs, but if you are upto it, this will be a great course.","5 Assignments : Assignments are actually easy, programing ones might take time depending on how familiar you are with matlab
2 quizzes, 
Midterm:easy","7","Machine Learning","COMS W4771"
"13","1921","Sun, 11 May 2014 21:31:54 GMT","29449","4057","If you find Itshack Pe'er teaching Machine Learning, avoid it, unless you know most concepts of ML in advance. 

Weekly assignments wasted most students hours and hours without any progress. The wording of assignment was very vague. To make situation worse the TAs were constantly unresponsive so you can't get clarification in time (and after the midterm they closed Piazza). 
The two quizzes, contained T/F questions, suffered same vagueness. 
The midterm question is interesting and good. although the grading of midterm is not very fair. it was OK. 
I have not taken the final exam yet, but the mock final seemed completely different to assignments and quizzes, to the extend that you might think it was for another course. ","weekly assignment (not easy!) + 2 quizzes (with 1 page cheat sheet) + 1 final + 1 mid","7","Machine Learning","COMS W4771"
"14","1921","Thu, 22 May 2014 00:32:05 GMT","29522","4057","Prof. Pe'er is really well-intentioned, and it's clear that he cares a lot about his students. I took a lot away from this class, even though it was a struggle. That said, DO NOT take this class if you're not remotely interested in machine learning - it's _not_ worth it. There are several other breadth/AI track courses that are (possibly) more interesting. If you _are_ interested in the subject, however, I'd definitely recommend taking this class with him instead of with Prof. Jebara. 

1) Teaching: If you have trouble staying awake in classes where professors speak really slowly/if you've ever been in one of the Mudd classrooms and know how boring they are, BRING COFFEE/TEA/anything that keeps you awake. Prof. Pe'er speaks really slowly, so much so that when you play his lectures at 1.5x speeds (they're all on CVN, which is great), it sounds like most people speaking at a normal pace. 
2) The material: While the class is very math-heavy (as are most courses on machine learning), Prof. Pe'er is very generous with his use of examples to provide better intuitions for the concepts/algorithms covered, and even tries to do live demonstrations to help make the math clearer. Some lectures and topics have a very steep learning curve even if you have the prerequisites covered, but I learned a tremendous amount from this class and I don't think I would have gotten that much from Prof. Jebara's far more theoretical approach. 
3) Homework: The homework is time consuming, not because each individual assignment is long, but because there are assignments EVERY WEEK. The assignments are hard, so starting in advance is essential (which means you're usually working on ML assignments 4 days a week at least), and responses on Piazza from the TAs are erratic and come in waves, so they're not reliable. Prof. Pe'er does allow group work with some constraints, so that usually makes working on assignments easier. But START EARLY. The assignments are also usually vaguely worded, which was a pain to deal with.
4) The tests: This was the most confusing part of the class. I think Prof. Pe'er experimented with a lot of testing styles because it was his first time teaching this class. (Either that, or he always throws 4 different testing styles at his students in all his other classes too because he thinks it builds character.) 
- Quizzes: multiple choice, where any number of choices could be true or false, and you lost points for either answering wrong or not answering at all. (So really, you had a 50% chance of getting it right anyway..) The questions on the quiz were theoretical and just requierd you to know the concepts, and some involved doing some basic calculations/inferences.
- Midterm: Easily the best test in this class. It was take-home and entirely programming, with 50% of the grade going towards an explanation of your approach. I think the grading was pretty fair - you got graded on the performance of your approach for the programming part, and the quality of your approach for the explanation. Very straightforward and doable in the 4 day timeframe given.
- Final: This came out of nowhere - the questions on the final ranged from proofs to algorithm creation to calculations - basically a very, very difficult exam. He gave us a practice final that, as it turned out, exactly resembled the actual final, but it still gave us no way to prepare, given that all the testing methods we'd had before were so different. It was almost impossibly long (though challenging and very interesting, required you to actually apply knowledge to real-world problems).

5) The curve: VERY generous curve. Another reason to definitely take this class with him and not Prof. Jebara. I think he really recognizes how hard he makes the class (in terms of workload, learning curve, difficulty of final) and curves to a high-ish B+. A large percentage of the class got A-range grades. 

Again, this is a professor who really cares about his students and the effort they put in, and isn't just looking to make this class frustrating and impossible. In general, he's very very responsive to feedback, even takes reasonable requests for class-wide extensions, and always tries really hard to make sure ever single student understands. I haven't had many 4000-level classes where that's the case, so this was refreshing. The class is still extremely frustrating, but ultimately rewarding if you like the material and put a lot of effort into the work.","Homework: 10 assignments (1 really simple setup assignment which includes a small Matlab script), 1 per week, all in Matlab  (25%)
Midterm: Programming with an explanation of approach (25%)
Quizzes: Two (a few weeks before and after the midterm) - multiple choice with any number of true/false options, theoretical (20% total)
Final: Impossibly long and very challenging final with lots of application- and theory- based questions. (30%)","7","Machine Learning","COMS W4771"
"15","1921","Tue, 27 May 2014 16:42:24 GMT","29586","4057","Machine Learning by Prof. Pe'er was an excellent class. The course was well structured, however the course load was pretty heavy. Nonetheless, the assignments and mid-term made you learn a lot. 

cons :-
1. The problem explanation in the assignments were vague at times. The TA's were irresponsive most of the times, thus most of the times went struggling with the problem statements.
2. It was difficult to follow prof in class, but hey, the lectures were recorded on CVN!

pros :-
1. The prof was very approachable and cared for his class.
2. He atleast tried to make sure that everyone gets the concepts right.

In a gist, i'd recommend this class to anyone who wants to learn machine learning in a way such that the intuition and math behind the concepts is both clear.
","~12 assignments(weekly) + 2 quizzes + midterm(take home, was sheer fun) + final(impossible)","7","Machine Learning","COMS W4771"
"16","1921","Tue, 03 Jun 2014 18:42:58 GMT","29610","4057","Machine Learning is a fascinating subject and is clearly a very valuable subject to know about. However, our class was very unfortunate to have been taught by Professor Pe'er. He is by far the worst professor I've ever had in my academic experience. To add insult to injury, he is very unapologetic about the way he manages things and treats his students unfairly. 

Assignments:
Every assignment included grammatical errors and unintelligible sentences in addition to mistakes in the problem descriptions. As a result, 1-2 day assignment would turn into a week-long affair. Future assignments are also based on answers to previous ones even though the class was not given the solution to the previous assignment. As a result, students who might have had incorrect answers in the previous assignment would unknowingly have errors in the next assignment.

Misinformation:
Professor Pe'er likes to portray himself as a fair individual but time and time again did he prove us wrong. Our first quiz was multiple choice test where correct answers were given 3 points and incorrect negative 2. However, the class was not told that leaving answers blank would result in negative marks too. Another example of this kind of behavior was demonstrated when he ran a poll to decide whether assignments should be due on a Friday or Wednesday. >80% of students who voted, voted for Friday yet the Professor appeared to have conveniently forgotten to tell the class that over 60% of the entire class needed to participate in the poll for it to be deemed valid. Something he decided to tell us after the fact. 

Sadly there are many more examples of this kind of behavior which is simply unprofessional. 

I can't speak to how Prof Jebara might teach this class and whether it's any better. But my main advice would be to stay away from Prof Pe'er, simply because you'll waste more time clearing up any confusions than being able to dedicate time to the actual subject.

 ","Weekly assignments - mostly time-consuming due to the fact that they had mistakes in them
2 Quizzes
Take home mid-term
In-class final ","7","Machine Learning","COMS W4771"
"17","1921","Sun, 22 Jun 2014 02:09:32 GMT","29645","4057","Pros: I thought the assignments were good, but super time consuming and there was one every week, that will squeeze all the time out of you, but in a way you learn.

Midterm fair and final was ok. Grading was reasonable.

Cons:
The worst classroom delivery I have ever seen in my entire life including school anywhere. Machine learning is no doubt fascinating but does require some foundation, but his classroom delivery is some of the worst I have ever seen, stammering, stuttering, is ok for CS 101, in a community college but totally unacceptable for a graduate level course in such a esteemed institution where the pay for professors is high and the fees are exorbitant.

On top of his inaudible and cringe inducing voice the material is complex but no doubt interesting. Professor needs to desperately address this and take a look at videos of himself on how to improve for future classes or otherwise just stay a researcher and not lecture.

Just look at the how well Andrew Ng did his course in Coursera on Machine Learning.

Because of the above it felt a waste of the money we spend on course here. I think Jebara would be much better, understandable and you would feel your moneys worth.

But if you can bear and listen to him maybe the course is made for you.
","Pretty tough but fair I thought for the scope of this course.","7","Machine Learning","COMS W4771"
