"","course_ids","created","id","professor_ids","review_text","workload_text","department_ids","name","number"
"60","3807","Thu, 20 Aug 2009 04:17:03 GMT","23082","515","This class the truly Terrible and unbelievably hard! It says that it is an into level class, but its not. This was the most time consuming, annoying and frustrating class I have ever taken. If you have taken AP comp sci, or have a better idea of java you will be struggling, but if you have none DO NOT TAKE! It was impossible with out outside help. 

Cannon is a funny man, and class was not boring, but the subject is just impossible. The theory stuff is easy and understandable but the java is very very hard and is not taught at all, its more teach yourself everything or find someone who knows what they are doing and have them teach you. 
I learned ALOT, but in the end, not worth it. 
","4 Programming Assignments, all pretty much impossible, but very rewarding when you finish them. Don't expect to do that well on them (close to 20 hours of work for each). 4 theory problem sets, more managable but still time consuming. Midterm and final, easier than programming assignments but still VERY hard and painful. ","7","Intro to Computer Science- Programming in Java","COMS W1004"
"61","3807","Sun, 15 Nov 2009 21:09:17 GMT","23289","515","A good teacher. I had zero comp sci background and am doing fine in the class, he's awesome at office hours and explains things really well. A lot of people who complain about the workload also start the assignments really late, which is a bad idea. A great class and a funny teacher, i enjoyed it. ","can be a lot at times, take his advice- if you haven't made in progress in half an hour stop and get help.
book questions can be a drag but are pretty easy","7","Intro to Computer Science- Programming in Java","COMS W1004"
"62","3807","Thu, 23 Dec 2010 20:48:26 GMT","25165","515","Cannon is awesome. With a couple of masters degrees and a phd, you know he's incredibly smart, but he also keeps the class moving well with his wit. Class attendance is typically helpful, but you can get by for most topics by simply doing the assigned reading. If you do attend class, supplementation with assigned reading is still ideal. The texts for the class are pricey so get them from a friend or rent them if possible. Only one of the two, Big Java, will really be useful after the course is over, so if there's one to buy, that's it. The books are thick, but the course does not cover nearly all the chapters in them.","This class necessitates a tremendous amount of effort and time, but it's totally worth it. The satisfaction of realizing the efficiency and power of a program you've just designed and built is unbelievable after you've spent hours debugging it. The class alternates a theoretical problem set from the book every other week with a programming project every other week. The problem sets are generally pretty simple and graded fairly, with the programming assignments much harder but graded fairly easily. The midterm and final were extremely easy, and the class is curved to something like a B+ average.","7","Intro to Computer Science- Programming in Java","COMS W1004"
"63","3807","Tue, 28 Dec 2010 02:38:23 GMT","25261","515","This is the class that made me want to major in Computer Science. At first I only took it because it was a requirement, but Adam Cannon is a skilled lecturer. He knows how to make confusing material digestible, and his classes are enjoyable.

I would recommend going to office hours - the TAs are generally pretty helpful, and it's useful to get feedback on your code before you submit it.

The programming assignments were a lot of fun, once you get into them. The book assignments (the theoretical ones) can be a pain, but they're necessary to grasp the material fully.

It's not necessarily the easiest class that you'll take at Columbia (unless you're already a programmer and therefore shouldn't be taking this class anyway). But it's also not the hardest - and it may even be the best and most important one you take. Make sure you take this class.","6 assignments, each with a programming part and a theoretical part. One midterm and one final (both easier than they could be, but you still need to study for them - means are in the 70s). Mean is curved to a ""high-B, not a B+"" (in his words).","7","Intro to Computer Science- Programming in Java","COMS W1004"
"64","3807","Thu, 20 Jan 2011 23:25:44 GMT","25578","515","Cannon is a great lecturer. He's very clear and has the wonderful ability to see things from a student's perspective. I believe he's been teaching this class for several years, every semester and so the class is well-planned and thought out.

I would recommend going to all the lectures, you'll really learn a lot and also you probably won't have to spend much time reading Big Java for the assignments if you attend class. Plus Cannon always goes on random CS-related tangents every once in a while and these are generally fun and informative.

As for the class, it's got two components; theory (Intro to CS) and programming (Intro to Java). Theory and programming homeworks alternate from week to week. Theory homeworks are not too bad, they can be done just from reading the relevant chapters in the book. Programming ones can be challenging and take varying amounts of time (depending on who you are) but you will certainly learn how to program at the end of it.

Midterm and final aren't all that bad if you've been keeping up with the lectures and the homeworks. They're a bit on the memorization side of things - especially the final which asked some pretty obscure questions which is why it's good to attend lecture because he often mentions random things that I noticed ended up on the test.

I should mention that although this is intro CS, it's a pretty high level intro so don't take the class for the granted - you'll have to put in some work to get an A.

Also there are lots of office hours and for the most part the TAs are great so I would highly recommend popping in if you have question regarding your assignment; even if you code works, you might wanna just make sure with the TAs that your design, etc. is okay.","See above.","7","Intro to Computer Science- Programming in Java","COMS W1004"
"65","3807","Tue, 25 Jan 2011 03:36:08 GMT","25601","515","Cannon is a phenomenal teacher.  If you're not interested in computer science, go to class just because it's fun.  Since it is an INTRO course to computer science and java, he does a really great job at explaining concepts, etc. and will happily answer any question.  You will learn so much more from being in class than by reading the textbook.

That being said, read the textbook and make notes!  The midterm and final both include a vocabulary section - where you have to write a definition for the given words (note, Cannon gave us a list of 100 possible terms for the final and tested us on 10).

The midterm is really easy if you're prepared.  Do the work, meet with TA's, etc. etc. etc.

The programming assignments will take a lot of time, so definitely do NOT start the night before they are due.

Let me say again - Cannon is a phenomenal teacher.  He is an amazing lecturer and makes class fun.  He always has a good story, funny / snide remark, or riddle / brainteaser to share. ","An assignment every week alternating between a written assignment (problems in the textbook) that is generally quite easy - and a programming assignment that is generally quite difficulty.  One midterm, one final.","7","Intro to Computer Science- Programming in Java","COMS W1004"
"66","3807","Tue, 05 Apr 2011 16:51:49 GMT","25698","515","I am not a computer science major or a computer science person at all; I'm not a math or science or logic person in any sense of any of those terms. My mind just doesn't work that way, and I struggled with this class more than I've struggled with any other class.

That being said, it was probably my favorite class thus far. Cannon is just a wonderful man who makes the lectures interesting, fun, and clear. He is incredibly welcoming ad supportive, so absolutely take advantage of his office hours. Talk to him about any concerns that you have - whether it's a specific coding problem or worries about the class in general - and he will help you. 

If you're not a computer science person, there is a lower level class that provides a lot of the background for this class, which I didn't know about, and could have done much better had I taken it. This is not an easy class, but it's very fulfilling. It's something I never could have seen myself doing, but I would absolutely recommend taking it. ","It's pretty tough. You definitely have to put the work in. Everything is doable, even if you don't have the familiarity in programming that a good majority of the class does. You'll be surprised at how capable you become, and this is one of the few classes where you are actually proud of your work and have something to show for it.
Tests are absolutely straightforward but you need to have a very deep understanding of the material. If you do all along, you won't need to study much, but if you are struggling, you'll need to put in a lot of time.","7","Intro to Computer Science- Programming in Java","COMS W1004"
"67","3807","Thu, 22 Dec 2011 15:38:48 GMT","26685","515","Cannon is great. He's an interesting lecturer (hilarious, and also super passionate), very receptive if you ever want to meet, has tons of office hours, and is always very fair. Also, he has tons of (useful) TA's, so basically there is always someone available whenever you need help on homework, including weekends. 

I had some experience with programming before taking this class, but I had to put a sizable amount of work into this class--the programming assignments take time. (But really, start early. The TA's can basically help you through any problems you're having if you go to office hours.) 

That being said, this class made me want to be a computer science major. It's incredibly fun and satisfying, and was definitely my favorite class this semester.  



","An assignment every week alternating between a problem set, which should take maybe an hour or two, and a programming assignment, which can take between 2-10 hours. This class really is manageable, as long as you start early and get help--people who say it took them 20 hours a week probably started homework due Monday on a Friday.

One midterm, one final, both very straightforward---if you do the readings and understand what he's talking about in class, you'll be fine.","7","Intro to Computer Science- Programming in Java","COMS W1004"
"68","3807","Mon, 26 Dec 2011 02:41:13 GMT","26744","515","When you enroll into this ""Intro"" to Java class, you are signing yourself up for a scheduled butt-kicking every time a programming assignment is due. 

Do yourself a favor and start the programming assignments early, and write down all your questions so that you can meet with the TA's during office hours to sort it out. 

Cannon is a fantastic teacher and he is very talented at keeping the entire class attentive during lecture. Take notes during class, because he only covers the important material, which makes sense, because that is exactly what appears on the midterm/final.","Homeworks worth 40% (2-3 from one Textbook, 2-3 from another Textbook, and 5-6 programming assignments), a midterm worth 25%, and a final worth 35%.","7","Intro to Computer Science- Programming in Java","COMS W1004"
"69","3807","Thu, 19 Jan 2012 19:49:55 GMT","26971","515","This course was difficult for sure.  There was a lot of learning on ones own simply because there was so much material, but there were resources there for use that could make ones life a whole lot easier, such as TAs.  This is where I have to disagree with the previous reviewer.  Madhavan was a standout TA.  He stayed after his office hours by as much as three hours one time because people needed help.  When he was in the TA room attending office hours for his own CompSci classes, he would help 1004 kids who needed help.  No matter how many people came he would individually go through his students code to find problems big and small.  He also didnt treat students who didnt know things like idiots which is more than can be said for some others of the TAs.  I would know, I went to pretty much every TAs office hours.  Madhavan was not an easy grader, but thats because he knows his stuff and demands a high standard; if you dont want to be held to a high standard, dont go to Columbia.  The TA Matt was also awesome though he wasnt my primary TA so I dont know his grading style&  Cannon was helpful but impersonal, class of 300&  You will feel accomplished after taking this class, but dont expect to sail.  But classes like this are why you come to Columbia, you work hard as hell, and then you get a ton out of it.","Punishing, but worth it.  Alternating problem sets and programming assignments.  Exams are straightforward and managable.  You do the time, and you will be ok.  Don't assume you are smart and will be fine.  Cannon says the first day of class, Engineers are made not born...","7","Intro to Computer Science- Programming in Java","COMS W1004"
"70","3807","Sun, 29 Jan 2012 20:06:45 GMT","27008","515","I actually took this class last year, spring semester but haven't got a chance to review it yet. Let me just say that there aren't many classes I'd actually feel obligated to review, but this is definitely one of them.

This is so far the best class I've taken at Columbia. This class gives you a great overview of Computer Science, and an unmatched introduction to programming. Somehow Cannon manages to fit in a ton of material while still giving a good sense of each topic. The only exception to this would be the section of the class on computer networks, which I honestly feel could have been narrowed down to just the information about internet protocols. 

Learning object-oriented programming has a learning curve, but once you've got it, you're just coasting from then on. That's not to say projects don't take a while -- you'll spend hours trying to find bugs in your program. But in general, I think there's only a few concepts in this class that are difficult to learn, the main one being OOP. Nonetheless, Cannon and the TAs make themselves pretty available to you, and the assignments are not unreasonable. That being said, pay attention to what Cannon says: if he wants you to understand a concept by a certain homework (e.g. what objects are) you should do it, and you'll be fine.

I think the main idea I want to convey with this review is that the work you do, while heavy, is very meaningful, and you'll learn a lot about algorithmic problem solving and programming in Java.","As mentioned, pretty heavy, but the work you're given is very meaningful, and you'll have a far elevated understanding of programming and CS by the end of the course. Tests have tricks here and there, but if you understand the concepts they're pretty easy. I finished the final in about half the time.","7","Intro to Computer Science- Programming in Java","COMS W1004"
"71","3807","Thu, 12 Apr 2012 04:15:52 GMT","27128","515","Well, he already has his silver nugget, but let it be said: Cannon deserves it. His lectures are fun to go to, and he tries really hard. I usually feel bad when people don't laugh at his dumb jokes so I laugh pretty hard to give him some credit. I usually enjoyed going to lecture. I never brought my computer, though, because all his example code is posted on courseworks anyway. You can do your note-taking just as well in a traditional notebook, and if you know that you are easily distracted, I'd recommend not bringing a computer. The two lectures that I did bring one I may as well not even have showed up because I have no idea what happened.

The course itself is hard, for sure. This class is an introduction CS and programming class, so if you never took AP Computer Science in high school, you're going into a topic that you've literally never seen before, unlike most of your other classes. It's pretty satisfying, though, when a few weeks in you're already writing simple programs that can do tasks that you couldn't do a few weeks before.

The programming assignments are tough, especially compared to the homework which literally take maybe 1-2 hours tops. Programming takes probably 10ish hours. The singular most important advice is go to the TA office hours. There are like 8 TAs for the class. Obviously the TA hours the day before your assignment is due are going to be packed, so try to go earlier if you can. The ones in the middle of the week are literally empty so you could have one-on-one time to do your work with a TA sitting right there who sole purpose is to answer any questions you have and help with your programming.

Cannon also sets up an account for the class on this website, Piazza.com, that is basically a messaging board where people can ask questions and the TAs, other students and Cannon (occasionally) can answer questions. This is a really good resource because your question has almost always been asked by someone else, and you can ask questions anonymously.","1 programming assignment every other week (10 hours give or take 2 or 3), 1 homework every other week (1-3 hours), 1 midterm, 1 final. Midterm is multiple choice, definitions, a section of code to debug, and an algorithm with questions about it. Final from what I understand (class isn't finished yet) is the same as midterm with more multiple choice.","7","Intro to Computer Science- Programming in Java","COMS W1004"
"72","3807","Thu, 11 Oct 2012 14:24:29 GMT","27577","12357","Literally the best TA in the world.

I've been fortunate enough to have him as a TA for three of my computer science courses, and every time I've needed help, he's been extremely responsive and helpful. He'll help you debug your code and patiently explain theory over and over if you need it.

Don is very patient during office hours. He was also the only TA in my COMS 1004 course who wasn't trying to make us all get Cs. His TA office hours are always packed because it's pretty known what a great TA he is.

I pretty much love him.","None, he's a TA.","7","Intro to Computer Science- Programming in Java","COMS W1004"
"73","3807","Wed, 29 May 2013 15:45:17 GMT","28476","515","Funny in class. Kind of mean in office hours. A fair grader. TAs in this class really care and are helpful. However, going to a TA other than the one who is going to grade your problem set is usually a waste of time because the open-ended short answer problems are subjectively and sometimes harshly graded. For programming assignments, all the TAs are amazing and Cannon gives good advice during class. 

Also there is a generous curve at the end, which is to be expected in a class of 200+ people","Heavy. Start early. Do all the reading. This class has more reading than two science classes combined, but the book is really helpful. If you do not read, you will not do well on the midterm or final. ","7","Intro to Computer Science- Programming in Java","COMS W1004"
"74","3807","Thu, 26 Dec 2013 02:09:34 GMT","28972","515","Adam Cannon is a pretty solid teacher. He knows his stuff, and is very organized when teaching. With this in mind, Intro to Java is probably one of the most challenging and time-consuming classes offered at Columbia. Unless you have to take this class for your major, be sure you REALLY want to take this class. There are much easier ways to learn coding and Java. When Cannon tells you at the beginning that this class will take at least 10 hours of work per week, he is telling the truth. Many times, the work requires a lot more than 10 hours/week. 

There is a lot of information that Cannon tries to teach in this course. You will learn both theory and programming in this class. Because of the amount of info he tries to teach, Cannon skips over a lot of basic stuff that he expects you to learn on your own. I had no experience in programming coming in so I wish he would not have skipped over stuff. For this reason, I would only recommend this class to someone who has some experience or background in coding. Talking to many who were in the same boat as me, we had to play catch-up throughout the semester. This class is already considered difficult to those with coding backgrounds, so it makes life even more miserable when you have to put even more work into an already difficult class.

The TAs for the class are usually pretty helpful. I would recommend getting help from the TA that grades your assignments since some of the grading, especially the written assignments, can be very subjective. I also went to Cannon's office hours. He does not come off as the nicest or most personable person ever, but he does try to help you out. He definitely does not try or care to get to know students (at least in this class). I will give him props for his cheesy jokes that lighten up the class.

In the end, you really have to decide if you are willing to do the work for the class. If you just want to take this class because you think coding will be ""fun"" to learn, do not take the class. Learn coding on your own at a pace where it can be fun, exciting, and addictive. Besides those who are majoring in CS, only those who are serious about learning Java and the theory of programming in a rigorous and often cutthroat setting should take this class.","The HW alternates between a programming assignment and written assignment. 1 midterm and 1 final. At least 10 hours/week is needed to do well in the class. Make sure you read the textbooks since he glosses over some stuff in class. Attendance is not mandatory, but you're only screwing yourself over if you skip classes.

Heavy Workload","7","Intro to Computer Science- Programming in Java","COMS W1004"
"75","3807","Wed, 15 Jan 2014 18:43:15 GMT","29145","515","If you're only going to take one Comp Sci course take Java with Professor Cannon. He is fully aware that most people have never coded before and provides very structured ways to allow people to easily understand coding. He doesn't start off too quickly and provides tons of sample code which is usually very similar to the homework he gives. He is very open to peoples comments and asks for questions. Probably one of the best classes I've taken at college so far. ","Alternating programming problem sets and written problem sets every week. Anywhere from 2-8 hours for the programming problem sets depending on how comfortable you are with the topic. About 2-3 hours for the written problem sets","7","Intro to Computer Science- Programming in Java","COMS W1004"
"76","3807","Sat, 03 May 2014 22:07:49 GMT","29398","515","I was apprehensive about taking this course since I had no experience with programming or computer science.

As I look back on this semester, I have come to the conclusion that yes, it is possible to take this course without prior knowledge of programming. However, it will require a lot of work on your part. If you're up for a challenge, this is the course for you.

In terms of personality, Cannon is quite friendly and cracks pretty good jokes in lecture. In his office hours, I found Cannon to be quite helpful and not at all sarcastic, in contrast to what other reviewers have said (but that might be because I came on a day in which very few students were asking him for help). 

Cannon is a decent lecturer, although he goes through concepts and examples very quickly. If you don't ask questions or follow up his lectures with your reading, you will get left behind. Be sure that you keep up at all times! (also, the textbooks for this class are quite helpful).

For problem sets and programming projects, do not procrastinate! They take much more time than you think they do (he's not kidding when he says that the class will require at least nine hours of work per week). If you get stuck, go to office hours, ask a CS friend, or use Piazza (the online messaging board) to get your questions answered. 

Overall, I'm glad that I took this course. It was challenging and I might not get the grade I want, but I'm glad that I learned something new. ","Each problem set is due after a week and each programming project is due after two weeks. Get started ASAP and make sure you do a little bit of work each day!

Midterm and final are difficult. Make sure you review the code presented in class (he might present a different version of a concept than in the book, so that's an added incentive to go to class) and read the books!

","7","Intro to Computer Science- Programming in Java","COMS W1004"
"77","3807","Wed, 21 May 2014 18:22:38 GMT","29519","515","If you've never had any programming/Computer Science, your first class will be a bit rough, but Cannon warns his students of this. For me, the first month or two were not too challenging, but mid-semester I hit a wall. Try to to the TAs before you feel confused, and if you feel the slightest bit confused, definitely go the TA or get a tutor. Makes life much easier in the long-run. Cannon is a great lecturer (especially for python!) and throws in a good number of jokes (that are actually funny!!) He is approachable and tries to make his introductory classes challenging for all but also accessible to people who aren't taking his class for the major. He also stresses the importance of improvement, and is willing to work with you if you scored really badly on the midterm as long as you improve on the final. The TAs for both intro. classes are great! For Java, study your vocab. A LOT.","Programming Project or Problem Set (only in Java, not Python) every two weeks. Midterm and Final. ","7","Intro to Computer Science- Programming in Java","COMS W1004"
