"","course_ids","created","id","professor_ids","review_text","workload_text","department_ids","name","number"
"18","2386","Mon, 24 Nov 2003 00:00:00 GMT","6861","1812","Excellent course taught by an excellent professor! The course revolves around the idea of teaching a computer to extract information from visual images, such as the position of an object, the position of edges, shape/depth of a scene from multiple images. Some of it will make you rethink the many things we as humans take for granted, and Shree likes to insert pertinent biological/philosophical/tech-biz tidbits that encourage an appreciation for the material beyond a purely CS perspective. The underlying theory could potentially get very mathematical, but Shree avoids that and focuses instead on the general ideas and principles. In sum, the subject material is interesting, challenging at times but rarely impossible.  As a teacher, Shree is one of the best out there. He is entertaining, funny, and very dedicated to making sure we learn. He is also a very effective lecturer with excellent presentation. So, although he is quite a busy man (a lot of conferences to attend) and had the TAs teach a couple of classes, I feel that we learnt more in his classes than usual.  All in all, a great experience and highly recommended.","5 HW assignments, each of which involves both writting exercises and 3-5 programs. Programs can be challenging, but again there's nothing impossible. Shree and the TAs are very helpful. If you keep up with the class and don't procrastinate, you will be fine.","7","Computer Vision","COMS W4731"
"19","2386","Wed, 10 Dec 2003 00:00:00 GMT","7054","1812","I loved this course.  Professor Nayar is an excellent lecturer.  He provides the class with handouts containing almost every slide he uses (yes, he uses slides on a projector, which is usually a bad sign, but he pulls it off well)... over 400 pages per student across the term.  This minimizes how much you have to take down in terms of notes, and allows you to spend more of the lecture making sure you understand, rather than copying down diagrams.
I have to agree with the previous review: Professor Nayar's digressions are always interesting, and regardless of whether they help understand the material, they help understand the motivations, or how vision works in humans.
It's not an easy class, but if you come to lecture all the time and pay attention, you shouldn't have trouble with the homeworks... 
the midterm and final may be a different matter though.  However, the professor and TAs are very helpful in office hours.","The homeworks aren't so bad... 5 or 6 of them, and I found that the programming actually got easier as the term went on (after the third homework).  However, the midterm and final were... insane, I thought.  The best study advice I can give is:  If you think there's no way it'll be asked, memorize it.","7","Computer Vision","COMS W4731"
"20","2386","Wed, 16 Jan 2008 00:00:00 GMT","20826","1812","Prof Nayar is a natural. He is clear and cogent and drives all the relevant points home. Be sure to hang on to every word he says, because its generally very deep. If possible, make notes on top of the slides he gives, they make it easier to understand them when you study for the exam. This is a no-nonsense course, only relevant stuff is taught. Therefore, read the slides very thoroughly. Its not much to read, compared to the Horn book which is quiet abstruse. The class is a great learning experience. Particularly because of the simplicity that Prof Nayar brings to it. If you ever have anything remotely close to Vision take this class. If you don't, take it to experience what a great teacher is like.","5 assignments. If the first freaks you out, hang in there, things just get easier. Overall assignments are easy. The slide handouts are all you need to prepare for the exams, and yes, some presence of mind.","7","Computer Vision","COMS W4731"
"21","2386","Tue, 04 Mar 2008 00:00:00 GMT","21026","1812","Professor Nayar is tied for my favorite professor.  The main reason I believe he is so good is because he conveys material in an extremely concise, understandable and well-spoken manner and really knows the subject inside-
out.  He is also very approachable in person and makes an effort to know students on some basic level.

The only thing that was a little weird about the vision class was the lack of math -- it was all in the slides but there is essentially no math in the entire class, which is in sharp contrast to the textbook.  In addition, the first homework is pretty ridiculous in many ways and shouldn't be considered as a measure of the class' overall worth.

Programming assignments are engaging, and exams are very fair.  Prof. Nayar makes use of the entire spectrum of scores on exams, and I feel gives proper questions to let those who understand subjects thoroughly to stand out.  The one complaint about them is that he does not even give a format for the exam, let alone sample questions -- this was very nerve-wracking for me personally but it ended up OK in the end.","The workload for the class is VERY front-heavy, so just get down and dirty early to enjoy the freedom from work at the end of the semester.  It can definitely be a more difficult workload, but not too bad.","7","Computer Vision","COMS W4731"
"22","2386","Wed, 16 Apr 2008 00:00:00 GMT","21143","1812","Professor Shree Nayar is the best professor I met at Columbia.  The course is very informative.  He gives great lecture with a sense of humor.  The TA are very helpful.  The assignments are not that hard but yet gives you a sense of how things really work.

I highly recommend this course to anybody who has interest in vision/graphics.  It's a must for students in vision/graphics track.

Highly recommended.","Not bad.  The assignments are getting easier after the third one.  But you need to spend lots of time on the slides to make sure you really understands the materials.

Final and midterms are well organized.","7","Computer Vision","COMS W4731"
"23","2386","Wed, 12 May 2010 20:33:20 GMT","24370","1812","I can see why people like him, but the material is extremely difficult, beware!

He makes lectures interesting and funny, but he glosses over important concepts and you never feel like you understand anything until the difficult midterm and final come around. You'll have to study your ass off just to pass.

The programs are a lot fun. They take some thinking, but overall they're well-structured and very useful. The theory questions on homeworks are impossible.

What's very unfair about this course though is that you can't recover from a single bad grade on anything (hw, midterm, or final). A single mess-up will glare at you on your final grade, not to mention that the curve is very small. The difference between letter grades is very slight, only a few points will be bump you up from a B+ to an A (notice there's no A-). But only a few points will drop you down from a B+ to a B-.

Unfortunately he grades strictly by the numbers, and no amount of asking questions in class, going to office hours, or demonstrating grade improvement throughout the semester will factor into your final grade. He has no problem setting the average to a low grade.","5 homeworks (they get easier over time)
1 midterm (impossible)
1 final (difficult)","7","Computer Vision","COMS W4731"
"24","2386","Sun, 18 May 2014 06:56:07 GMT","29503","1812","Possibly the most difficult class in the CS department. 

Professor Nayar is also possibly the best professor in the department. Great lecturing style, clearly super intelligent, and genuinely does his best to make sure we understand the material. That said, we cover a lot of material in this class, and preparing for the exams is hellish. The exams generally cover some of the easier concepts in the class, but it's also easy to lose points on proofs and there are also quite a few questions where you just have to remember a specific detail or some model which you otherwise can't derive on the spot. No way around some of this stuff unless you put a lot of time into memorization of the material.

Homeworks are great! They're done in MATLAB now (I think he said they were in C until a couple years ago), so they're constantly evolving - Nayar admits as much himself, especially that he put a lot more material in the class and on the HWs this semester. This is not a class you want to procrastinate on (nor can you afford to). If you start the night before, you may stay up all night, and just not be able to finish due to the difficulty of some of these homeworks. You should start at least a few days before so you have time to consult the TAs because you will inevitably run into MATLAB bugs, amongst other issues with understanding the Vision algorithms themselves.

You should probably attend every class because Professor Nayar doesn't post any of the material on courseworks. The TAs print out all the lecture slides and you pick up one of these packets at the beginning of each class. These are literally just printouts of the slides, so you'll want to take miscellaneous notes and comments based on what the professor says while presenting each slide.

We didn't receive any information about the distribution of grades this semester, so I can only comment that my grade was definitely lower than expected. A few people have said the same thing about their grades, but we can't make any generalizations. Just know it's a hard class - if you get a low grade, don't worry too much about it because this is one of the best, most useful classes you'll take in the CS@CU department, from one of the best professors around.","5 homeworks (1-3 non-programming, 1-2 programming problems per HW). HW is 50% of your grade. Midterm (15%), Final (35%). Homework could take anywhere from 5 to 40 hours per assignment. Writing the skeleton code for basic functionality doesn't usually take too long if you understand the algorithms/concepts to use, but there are always faster and better ways to implement certain things. Whether it's MATLAB vectorization or clever use of convolutions, you have to think things through pretty well to attain top marks. This takes time, and can cause problems if you're not already familiar with MATLAB syntax and other tricks. ","7","Computer Vision","COMS W4731"
"25","2386","Sun, 08 Jun 2014 06:39:27 GMT","29624","1812","Vision was the most rewarding class by far. Prof. Nayar is funny, smart and makes lectures very interesting. He has an answer to all of your questions. He likes discipline, mind you, but is not that fanatic about it.

You cannot miss any of his lectures as the slides will stare at you when you prepare for the midterm or final. You get printed slides so you just need to take down additional notes (if any).  In Spring 2014, he tried a lot of new material and so the overall workload increased exponentially after midterm. He also took feedback post midterm and in the last class to update the class materials. There were review classes in the lecture before the tests which were quite helpful, if at all you started preparing!

It helps to have a study group as making sense of each slide takes up a lot of time although everything seems like a breeze during the class. TA's were very helpful. Thomas was a little picky in giving points but used to explain important concepts easily. You won't understand where exactly you lost points but they do indicate the relevant challenge number. Though programming in MATLAB seems easy, debugging is a headache. Make sure you proceed step by step. Just a tip: avoid built in functions unless you are completely sure of what they return. Getting a working solution was not enough to secure full points. You need to provide a 'smart' solution.

I was taking Computer Graphics along with it and I must say a lot of my fundamentals got cleared through this class. His 'Math Primer' slides were just mind-boggling. Everything was explained in such an elegant manner. Overall, ""you get a lot for the tuition you pay"" in Prof. Nayar's words!","Heavy. 5 Homeworks (1 Theory, 4 Programming + Theory) + Midterm + Final.

You generally have more than two weeks for each HW. No late days. First assignment had basic MATLAB intro but some challenging theory questions. Second one was the toughest for me and I lost a lot of points since I started just the night before. Rest of the HWs were decent and rewarding provided you start early i.e. the previous weekend or so. You implement a panorama stitcher, refocusing app...how cool is that!

Midterm as well as the final were not tough but there were few challenging questions to identify people who could think a little out of the box. Overall the avg was quite high ~ 20/30 midterm and ~ 35/48 final.","7","Computer Vision","COMS W4731"
"26","2387","Wed, 10 Dec 2003 00:00:00 GMT","7055","47","This is a spectacular class!

It's officially limited to 30, and there's a chance you'll have to compete somewhat for a spot in the class, but that's rare - my class had 23 or so people at the beginning, and ended up at 21 for the bulk of the term.

Unlike most CS classes, Programming & Problem Solving is a discussion-based class.  There are four projects across the term (each covering about 3 weeks).  There are 5 discussion classes per problem (in which the class demos their latest solutions and discusses their approaches), and one class where each group presents their report.
Groups are randomly determined, but you can request to work with particular students (but you can only work with each person on ONE project).  The groundwork for the problem-solving has been done for you - the TA provides the class with a simulator program and the interface for your code to use, so you can dive in and typically write a simple/naive solution to the problem in twenty minutes or so, leaving you most of the project time to create and implement more complex solutions - there is almost no setup work.
The class works on full disclosure and full sharing - you can take any code you find online and use it, as long as you say you did, and you can rip off your classmates as much as you want, as long as you credit them for what you ripped off.
One of the great things about this class is that it brings you into a group of some of the best minds currently studying at the school.  It will have you thinking differently about all sorts of problems.  The other great thing about the class is how I always left the discussions wanting to work on the project - unlike most classes where the assignments are fairly arbitrary, you have a great deal of leeway in the deliverable, and typically you have something you want to try.
I would recomend this class to anybody who feels comfortable with a discussion-
oriented problem-solving case study.

Also, I would reccomend Professor Ross' databases course - he is an excellent professor.","It really varies by both your group and how much work you want to put into the class.  However, the more you put in, the more you get out.  And you'll probably find you want to work more for this class than your other classes.","7","Programming & Problem Solving","COMS W4444"
"27","2387","Mon, 15 Dec 2003 00:00:00 GMT","7129","47","As you can read on CULPA and the SEAS Oracle, students who have taken this course generally have lots of positive things to say about it, most of which are absolutely true.

However, because the course places such a huge emphasis on collaboration and the interchange of ideas,  what you get out of it varies greatly with the competence and creativity of your fellow classmates.  For some reason, Prof. Ross seems convinced that the course ""self-selects"" smart people, that those enrolled in it are naturally highly critical/creative thinkers.  This may have been true for past offerings of this course, but I did not find it to be the case when I took it.

Out of 22 students, maybe 8 regularly produced creative, original ideas and could competently implement them.  Most of the others were pretty average, while a few people were just plain dumb, lazy, or both.  This may sound harsh, but when you find yourself teamed up with one or (gasp) two of these people and have to think through an inventive problem solution, code it, and write the final report all by yourself, you *will* feel your urge to kill rising.  Also bear in mind that all members of a group receive the same grade, and there is no formal peer review process.

I still recommend this course; it has several important merits that others have mentioned, and what you learn in it will stay relevant long after you forget the intricate details of distributed transactions or lambda calculus.  If you put in the work, you will walk away content unless, like me, you don't suffer fools gladly.  If you don't put in the work, you will still do relatively well at the expense of those who do.","Up to you.  You are, of course, encouraged to put in an equitable amount of work, but there do not seem to be any serious repercussions for those who do not.","7","Programming & Problem Solving","COMS W4444"
"28","2403","Mon, 15 Dec 2003 00:00:00 GMT","7122","37","First off, I took Data Structures with the guy too.  Everyone who wrote a bad review of this guy is rather stupid.  Swing interfaces are key parts of every assignment involving Java after Data Structures.  Furthermore, copying code to create the data structures is fine - it's a matter of using them - why do you think the class is considered a difficult one for many?  Because they don't know how to copy properly?

But I digress.  Robotics is Allen's specialty, and he clearly shows he knows what he's talking about.  The class has some rather cool aspects about it, including the use of a robot simulator.  You actually apply concepts from linear algebra to something.  Furthermore, it gives a solid background to what kinds of projects are going on in robotics.  Some of it is basic at first, but it gets better as it progresses.","The workload is fair and requires a bit of time, but most written assignments can be done in a night.  Programming assignments take a bit longer, but they're pretty cool after finishing them, unlike many CS classes that offer useless programming assignments.","7","Computational Aspects of Robotics","COMS W4733"
"29","2403","Thu, 06 Oct 2005 00:00:00 GMT","12824","37","I had Prof. Allen's class right after Prof. Rocco Servedio's class. The contrast could not have been clearer -- while Rocco is a clear and competent lecturer who is quick on his feet and always able to answer questions, Allen is a bumbling, incompetent waste of time. He was never once able to answer any questions posed to him in a way that suggested he understood either the question or even the material. His lectures were disorganized, rambling, and unintuitive. He is far and away the worst professor I have ever had at Columbia Computer Science (and perhaps tied for worst ever at Columbia). ","Not too bad. A number of time consuming programming assignments, but they're fun.","7","Computational Aspects of Robotics","COMS W4733"
"30","2403","Mon, 14 Apr 2014 04:56:30 GMT","29326","37","The homeworks are relatively easy, the projects are ""fun"" (in that nerdy way that CS kids love), the classes are not really necessary to go to after the linear algebra sections have been covered, but the midterm and final are kind of bullshit. Allen only gives you a general overview of what might be on it, without a practice test, and the questions on it are weird; often testing cursory knowledge of subjects not covered in any assignment or project. It felt like the final was ""trying"" to be harder than the rest of the class just to achieve a nice grading curve.

That said, here are the pros:

You get to program for an actual, real-world machine, which is something you don't really get to do in many other classes. It's a different kind of debugging when you have to find out how slippery a certain floor is and factor that into your motion calculations to account for drift. 

You also get to use linear algebra in a very practical way, (It really cemented a lot of the fundamentals I had only weakly grasped after taking intro to Linear Algebra). Lastly, it also serves as an intro to Computer Vision as well, some of the later homework assignments require you to mount a camera on the robot and do image processing to solve certain puzzles.

In summary, it's a class that kind of feels like an easy-A class despite having a respectable work-load (the projects) and arbitrarily difficult exams. Allen is a lenient grader for the projects, but not for the midterms. This is definitely an ""application"" class, not really a ""theory"" class. Take it if programming a Roomba sounds like something you would like to do; for all its flaws I enjoyed it well enough.","Respectable; it's a class with a programming workload, expect to be submitting things at 11:55pm on the night they're due at least once or twice.","7","Computational Aspects of Robotics","COMS W4733"
"31","2767","Wed, 05 May 2004 00:00:00 GMT","8557","2060","Prof Reed is an excellent teacher.  He is well prepared for class and knows his material very well.  He is especially helpful during office hours.  His is not a hard professor to get a hold of because he constantly checks his e-mails (and replies to any questions one might have) and gives you his cell phone to call if necessary.  The course covers curves and surfaces.  He covers bezier and b-spline curves.  He also gives lots of examples in class and goes over it in detail.  There isn't any trick for the midterm and final and tells you what to study.  In all, I learned quite a bit about curves/
surfaces and feel that professor is a terrific teacher!","There are 4 programming assignments that have to be written in java.  He gives you the foundation for each assignment and all you have to implement is the algorithm.  The programming assignments were reasonable plus he gives you the psuedo-code and goes over some examples in class. ","7","Topics in Computer Science: Computational Aspects of Geometric Design","COMS E6998"
"32","2767","Thu, 30 Aug 2012 04:02:49 GMT","27517","2060","A really interesting computer graphics class with an amazing professor. In this class, we are given a glimpse to the realm of geometry modeling and geometry processing. As we live in the age that artists and product designers utilize 3D software such as Rhino or Maya or ZBrush, to digitally model their products before actualization into tangible objects, or to model cartoon characters that would appear in animated films, this class provides a great introduction into the technical aspects of how these 3D softwares work or should work. We study the fundamentals down to the level of so-called NURBS curves and surfaces, geometry processing performed on triangle meshes, and subdivision surfaces -- each with extensive mathematical backgrounds that consider how these structures give artists and manufacturers computational advantages such as desired degree of smoothness no matter what shape of the curves/surfaces are formed. It is a really fun experience to learn how design softwares are actually made of, and we also had a guest speaker from the industry to discuss how he actually uses the software to design real-world products.

So the class covers mainly three parts: the fundamentals of B-Spline curves and surfaces (as well as NURBS and Rational form), geometry processing (in particular, mesh data structures and mesh simplification algorithms), and Subdivision surfaces (e.g., Catmull-Clark). Each topic has extensive assignments associated with it to help us see how things are implemented. Some are really challenging, but Prof. Reed would give us extensions if needed. So we always have time to refine our assignments as possible. I'd say I'm very proud of the code I have done for this class, since they never look like a mess compared to other classes that I sometimes rush things through just to make it work. It's so organized, and beautiful.

Speaking of the professor, he is probably one of the best professors I've had for Computer Science class, personality-wise. He really took time to answer individual emails and discussion threads. He modified his assignments plan as the semester went, so we were given more challenging works since we did well as a class on the first few assignments, which helped me to learn even more. He was very approachable during his office hours or after class. So in a sense, you never feel isolated or helpless in this class. The only caveat is that his lectures sometimes may be a bit dry, but bare with them, and you will go a long way.

So, even with a slight interest in computer graphics in general, I'd recommend you to come and take the class, and you will be amazed how much you learn and have fun at the end.","3 Assignments, each covering main topic in the class, as mentioned above.

In actuality, it feels more like 6 assignments. The B-Spline one will be split into 3 parts, while the geometry processing is split into 2 parts. However, they aren't equal in length. Some will be shorter; others will be longer.

1 Midterm. 1 Final. Totally reasonable and manageable.","7","Topics in Computer Science: Computational Aspects of Geometric Design","COMS E6998"
